{
  "catalogue_version": "v1.0",
  "constitution_version": "1.0.0",
  "effective_date": "2026-10-16",
  "policies": [
    { "policy_id": "POL-SPEC-001", "title": "Approved specification exists before implementation", "domain": "compliance", "severity": "mandatory",
      "source": { "principle": "I", "text": "Production implementation MUST NOT begin without an approved specification." },
      "evaluation_points": ["BEFORE_IMPLEMENT"], "check": { "kind": "evidence", "ref": "approved-spec-present" }, "exception_allowed": true },
    { "policy_id": "POL-SPEC-002", "title": "Requirements are testable and traceable", "domain": "traceability", "severity": "mandatory",
      "source": { "principle": "I", "text": "Requirements MUST be testable and traceable." },
      "evaluation_points": ["AFTER_NORMALIZE", "COMPLIANCE_CHECK"], "check": { "kind": "automated", "ref": "requirements-have-acceptance-criteria-and-ids" }, "exception_allowed": true },
    { "policy_id": "POL-SPEC-003", "title": "Functional and non-functional requirements stay distinguishable", "domain": "traceability", "severity": "mandatory",
      "source": { "principle": "I", "text": "Functional and non-functional requirements MUST remain distinguishable." },
      "evaluation_points": ["AFTER_NORMALIZE"], "check": { "kind": "automated", "ref": "requirement-kinds-distinct" }, "exception_allowed": true },
    { "policy_id": "POL-SPEC-004", "title": "Ambiguities resolved or recorded as explicit assumptions", "domain": "process", "severity": "mandatory",
      "source": { "principle": "I", "text": "Ambiguities MUST be resolved or recorded as explicit assumptions." },
      "evaluation_points": ["AFTER_NORMALIZE", "BEFORE_IMPLEMENT"], "check": { "kind": "automated", "ref": "no-open-material-ambiguity" }, "exception_allowed": true },
    { "policy_id": "POL-SPEC-005", "title": "Material upstream changes trigger downstream impact analysis", "domain": "change-control", "severity": "mandatory",
      "source": { "principle": "I", "text": "Material upstream changes MUST trigger downstream impact analysis." },
      "evaluation_points": ["ON_CHANGE", "ON_REPLAN"], "check": { "kind": "automated", "ref": "impact-analysis-present-for-material-change" }, "exception_allowed": true },
    { "policy_id": "POL-SPEC-006", "title": "Code changes map to requirements", "domain": "traceability", "severity": "mandatory",
      "source": { "principle": "I", "text": "Existing code MUST NOT become an undocumented substitute for the specification." },
      "evaluation_points": ["COMPLIANCE_CHECK"], "check": { "kind": "evidence", "ref": "code-changes-cite-requirement-ids" }, "exception_allowed": true },

    { "policy_id": "POL-ORCH-001", "title": "Explicit dependency graph or state model in use", "domain": "process", "severity": "mandatory",
      "source": { "principle": "II", "text": "It MUST use an explicit dependency graph or equivalent stateful model." },
      "evaluation_points": ["COMPLIANCE_CHECK"], "check": { "kind": "automated", "ref": "plan-graph-valid" }, "exception_allowed": true },
    { "policy_id": "POL-ORCH-002", "title": "Every stage defines inputs, outputs, criteria, ownership, failure behavior", "domain": "process", "severity": "mandatory",
      "source": { "principle": "II", "text": "Every stage MUST define inputs, outputs, entry criteria, exit criteria, ownership, and failure behavior." },
      "evaluation_points": ["COMPLIANCE_CHECK"], "check": { "kind": "automated", "ref": "node-catalogue-complete" }, "exception_allowed": true },
    { "policy_id": "POL-ORCH-003", "title": "State, context, provenance, and decision lineage preserved", "domain": "traceability", "severity": "mandatory",
      "source": { "principle": "II", "text": "Workflow state, cross-stage context, artifact provenance, and decision lineage MUST be preserved." },
      "evaluation_points": ["COMPLIANCE_CHECK", "ON_REPLAN"], "check": { "kind": "automated", "ref": "lineage-complete" }, "exception_allowed": true },
    { "policy_id": "POL-ORCH-004", "title": "Agent autonomy is bounded, observable, and auditable", "domain": "security", "severity": "mandatory",
      "source": { "principle": "II", "text": "Agent autonomy MUST be bounded, observable, and auditable." },
      "evaluation_points": ["COMPLIANCE_CHECK"], "check": { "kind": "automated", "ref": "no-unaudited-agent-action" }, "exception_allowed": true },

    { "policy_id": "POL-HUM-001", "title": "High-impact actions have explicit human approval", "domain": "compliance", "severity": "mandatory",
      "source": { "principle": "III", "text": "High-impact actions MUST require explicit human approval." },
      "evaluation_points": ["RELEASE_READINESS", "COMPLIANCE_CHECK"], "check": { "kind": "automated", "ref": "all-gates-have-valid-approval" }, "exception_allowed": false },
    { "policy_id": "POL-HUM-002", "title": "Approval, rejection, escalation, timeout, and safe-stop behavior defined", "domain": "compliance", "severity": "mandatory",
      "source": { "principle": "III", "text": "Approval, rejection, escalation, timeout, and safe-stop behavior MUST be defined." },
      "evaluation_points": ["COMPLIANCE_CHECK"], "check": { "kind": "automated", "ref": "gate-definitions-complete" }, "exception_allowed": false },
    { "policy_id": "POL-HUM-003", "title": "Mandatory approval gates are not skipped", "domain": "compliance", "severity": "mandatory",
      "source": { "principle": "III", "text": "Mandatory approval gates MUST NOT be silently skipped." },
      "evaluation_points": ["COMPLIANCE_CHECK", "RELEASE_READINESS"], "check": { "kind": "automated", "ref": "no-skipped-gate" }, "exception_allowed": false },
    { "policy_id": "POL-HUM-004", "title": "Lack of response is never approval", "domain": "compliance", "severity": "mandatory",
      "source": { "principle": "III", "text": "Lack of response MUST NOT be interpreted as approval." },
      "evaluation_points": ["COMPLIANCE_CHECK", "RELEASE_READINESS"], "check": { "kind": "automated", "ref": "no-approval-from-timeout" }, "exception_allowed": false },

    { "policy_id": "POL-TEST-001", "title": "Red-green-refactor evidence for domain and orchestration behavior", "domain": "process", "severity": "mandatory",
      "source": { "principle": "IV", "text": "An initially failing test MUST be written before the corresponding implementation." },
      "evaluation_points": ["AFTER_TEST", "COMPLIANCE_CHECK"], "check": { "kind": "evidence", "ref": "red-before-green-recorded" }, "exception_allowed": true },
    { "policy_id": "POL-TEST-002", "title": "Required test categories present", "domain": "process", "severity": "mandatory",
      "source": { "principle": "IV", "text": "The test suite MUST include unit, integration, API contract, orchestration transition, reliability, security, and end-to-end tests." },
      "evaluation_points": ["AFTER_TEST", "RELEASE_READINESS"], "check": { "kind": "automated", "ref": "test-categories-present" }, "exception_allowed": true },
    { "policy_id": "POL-TEST-003", "title": "Completion requires executed validation", "domain": "process", "severity": "mandatory",
      "source": { "principle": "IV", "text": "Task completion MUST require executed validation, not merely generated code." },
      "evaluation_points": ["AFTER_TEST", "RELEASE_READINESS"], "check": { "kind": "automated", "ref": "tests-executed-for-all-requirements" }, "exception_allowed": true },

    { "policy_id": "POL-SEC-001", "title": "Input validation and URL scheme restriction verified", "domain": "security", "severity": "mandatory",
      "source": { "principle": "V", "text": "External input MUST be validated and normalized. Acceptable URL schemes MUST be restricted." },
      "evaluation_points": ["AFTER_TEST", "COMPLIANCE_CHECK"], "check": { "kind": "evidence", "ref": "security-input-tests-passed" }, "exception_allowed": true },
    { "policy_id": "POL-SEC-002", "title": "No secrets or sensitive information in logs and evidence", "domain": "security", "severity": "mandatory",
      "source": { "principle": "V", "text": "Secrets and sensitive information MUST NOT be exposed in logs." },
      "evaluation_points": ["AFTER_TEST", "COMPLIANCE_CHECK", "RELEASE_READINESS"], "check": { "kind": "automated", "ref": "secret-scan-and-log-redaction-tests" }, "exception_allowed": true },
    { "policy_id": "POL-SEC-003", "title": "Secure configuration defaults", "domain": "security", "severity": "mandatory",
      "source": { "principle": "V", "text": "Secure configuration defaults MUST be applied." },
      "evaluation_points": ["AFTER_TEST", "COMPLIANCE_CHECK"], "check": { "kind": "automated", "ref": "default-config-secure" }, "exception_allowed": true },
    { "policy_id": "POL-SEC-004", "title": "Security documentation present", "domain": "security", "severity": "mandatory",
      "source": { "principle": "V", "text": "Authentication assumptions, rate limiting, threat scenarios, and security trade-offs MUST be documented." },
      "evaluation_points": ["COMPLIANCE_CHECK"], "check": { "kind": "evidence", "ref": "security-docs-present" }, "exception_allowed": true },
    { "policy_id": "POL-SEC-005", "title": "Dependency and secret scanning executed with no unresolved high or critical finding", "domain": "security", "severity": "mandatory",
      "source": { "principle": "V", "text": "Dependency scanning and secret scanning MUST be included in release readiness." },
      "evaluation_points": ["COMPLIANCE_CHECK", "RELEASE_READINESS"], "check": { "kind": "automated", "ref": "scans-executed-no-unresolved-high-critical" }, "exception_allowed": true,
      "advisory_note": "DEC-054: an unresolved high or critical finding (neither remediated nor covered by a human-approved exception) fails this policy and blocks release readiness." },

    { "policy_id": "POL-CHG-001", "title": "Policy version recorded for the run", "domain": "compliance", "severity": "mandatory",